Hash,Date,Message,orion,hera,gaeac6,hercules,derecho,ursa,wcoss2,acorn
d3caf3e5,2025-09-15,update mom6 to its main repo. 20250818 commit (#2866),1745,1735,1609,1931,,2282,,3247
5e3a9259,2025-09-10,Introduce tuning parameter for convective cloud liquid for GFSv17/GEFSv13/SFSv1 (#2872),1748,1734,1604,1925,,2290,,3245
e7ee38e2,2025-09-08,Scale-aware 3DTKE EDMF and TTE-EDMF GFS PBL related updates (#2806),1753,1723,1605,1926672,,2296,,3248
688de8eb,2025-09-04,Fix default cdmbgwd settings (#2788),1752532,1740,1605,1928772,1675,2311,,3247
7e711129,2025-09-02,Use container with spack stack 1.9.2 (#2870),1746,1732,1601,1921356,1675,2298,,3247
d4bac232,2025-08-29,MPAS dycore + Atmosphere Generalization & Update RAP tests to FHMAX=12 (#2780),1746,1732,1601,1921356,1675,2298,,3247
118cff46,2025-08-25,Add FV3 grid mask for regional domains to speed up nearest n. interpolation; Update CMEPS and CDEPS (#2862) (#2818),1755,1733,1600,1932,1676,2298064,,3244
071b9f95,2025-08-22,Fix Restart IAU and Ultra-Low Reproducibility Issues by Adding Control Parameter to Restart File (#2851),1757,1738,1601,1936776,1673,2299,,3244
dc9cfba6,2025-08-19,Update CICE through 2025-07 and switch to ice history variables with expected ranges. Sync of WW3 develop to dev/ufs-weather-model (#2852),1758,1738,1602,1936460,1675,2314,,3244
a180bbe4,2025-08-15,FV3: Fix Prate_avg and UPP call freq + Fixing repo sync check with proper if...else block and re-instatiatin… #2859 (#2836),1760880,1738,1601,1934240,1678336,2313,,3243
417a2cf1,2025-08-13,Fix conus13km tests restart and decomposition reproducibility + Update the detection of Hera/Ursa #2858 (#2753),1747,1736,1605,1931968,1679184,2331,,3244
61e54d9b,2025-08-11,Add two-way ocean-wave coupling feature to the HAFS applications (#2584),1748,1731,1607,1937220,1674884,2284,,3243
ce74044c,2025-08-06,"Create a user-friendly ""process model"" testing capability + update MOM6 to its main repo. 20250801 commit #2849 (#2719)",1753,1745,1603,1933176,1679956,2281,,3245
d820b67f,2025-08-01,Update GOCART to v2.4.3 (#2819),1751,1738,1600,1929680,1675332,2272,,3248
5e13aaf2,2025-07-29,Update DATM meshes and switch to bilinear mapping; Reinstate med restarts for 4 tests after update to ESMF 8.8 (was #2796) (#2733),1742,1737,1581276,1912864,,2246,,3113
e39a250c,2025-07-24,Update FV3 hash to include UPP ss192/Ursa updates (#2814),1752,1727,1589164,1909608,1593,2277,,3110
8b52797d,2025-07-21,"Combination of 2684,2707,2771 (MERRA2 3-hr, photochem diag, prog closure SFS) (#2813)",1745,1717,1578,1912756,1593,2280,,3112
93d51aef,2025-07-17,Exporting Canopy Variables from AQM to Facilitate Sub-Canopy Effects in FV3 and CCPP (#2630),1741,1739,1578,1912068,1592,2267,,3111
c5b3a3c8,2025-07-14,GFDLMP-v3 and TEMPO MP microphysics (#2503),1747,1740,1580240,1907852,1596,2241,,3116
f9c10462,2025-07-11,Combination of several CCPP-physics PRs (#2790),1744,1727,1577084,1915708,1592,2250,,3116
0e960577,2025-07-09,"Combination #2777 (maintask writes CMEPS restart log), #2779 (FV3 CI/CD), and fix RT if statement blocks (#2795)",1744,1735,1583,1910,1593,2300,,3113
065def80,2025-07-07,Port UFS-WM to Ursa (#2471),1746,1722,1584,1914120,1594,2249,,3116
995c51d1,2025-07-03,Upgrade UFS-WM to spack-stack/1.9.2 (#2650),1746,1722,1584,1917,1594,,,3116
1f0ab432,2025-07-01,Reduce WW3 memory use (#2624),1781,3261,1625,1960656,3164,,,3113
8f8fddc8,2025-06-30,Bring in scale-aware 3DTKE related changes for GFS TKE EDMF PBL scheme #2734; Add option in GFS PBL to use liquid/ice potential temperature in local mixing #2763; Update MOM6 to its main repo. 20250527 commit #2757; Mom6 025 warmstart option #2761 (#2734),1782,3246,1623,1953,3160,,,3114
24d8dfd4,2025-06-26,Slight modification in orographic gravity wave drag (OGWD) scheme (#2752),1782,3258,1620,1952860,3150,,,3114
5750b9e3,2025-06-20,gcycle update (#2747),1782,3256,1618,1951848,3161,,,3112
a9999828,2025-06-12,Add a new parameter in dycore to control cutoff level for implicit RF  (#2730),1783536,3250,1623,1953616,3150,,,3115
9193010a,2025-06-06,"In Noah-MP, set zero for canopy liquid and canopy ice over glacier  (#2723)",1778,3261,1624,1940,,,,3113
43f2c3bd,2025-06-04,Urgent Documentation Update for HSD Capability Announcement  (#2765),1776,3246,1609,1936988,3151,,,3114
f22b2e11,2025-06-02,Bug fix for surface roughness calculation over lakes and sea ice points when wave model is turned on (#2739),1776,3246,1609,1936988,3151,,,3114
aebf9781,2025-05-27,Fix bug to improve wave initialization by saving location/weights for point output (#2737),1779,3235,1620,1936556,3152,,,3115
4cbe50f4,2025-05-23,"Add idealized, regional tropical cyclone test to tests-dev (#2693)",1776,3218,1619,1950544,3153,,,3114
269e181a,2025-05-23,Add GFSv17 IAU restart tests without waves + Add tags to stoch physics int variables + Fix filepath in user's guide (#2691),1776,3218,1619,1950544,3153,,,3114
68fd7faa,2025-05-15,"Enable Hera, Hercules Gnu tests: cpld_debug_p8_gnu and cpld_control_p8_gnu + revert MOM6 ISO code #2729 (#2694)",1775,3234,1623,1953452,3152,,,3115
1c5a9f12,2025-05-09,"Add ""ultra low"" coupled configurations to RTs (Reopen #2564); update inputdata; clean up misc items in multiple test configurations (#2663)",1775,3254,1623,1944104,3152,,,3115
aba31a4e,2025-05-06,Resolve miscellaneous WM issues and update documentation (#2633),1774,3235,1619,1966664,3150,,,3113
b81282e5,2025-05-05,Switch to vector remapping and bilinear interpolation for global coupled configurations (#2690),1774,3235,1619,1942676,3150,,,3113
5a297a6e,2025-05-02,improve coupled model startup cost for waves; Add switch to disable InfoBroadcast in fv3 cap run phase2 (was #2721) (#2715),1777,3232,1618,1956444,3152,,,3112
ff162f36,2025-05-01,NSSL MP scheme updates + Stochastic Physics CI/CD & Unit Test (#2661),1781,3233,1621,1953360,3154,,,3110
9e4778cd,2025-04-25,Loosen restriction on optional arguments in CCPP Framework (#2573),1786,3221,1619,1940380,3162,,,3109
4a566203,2025-04-23,CMake Atmosphere Dycore Generalization + Fix for JEDI cubed sphere grid #2708 (#2604),1775,3213,1618,1943104,3152,,,3108
4f0111b2,2025-04-21,Add CMEPS log file at restart write; IAU Tags for Global Workflow (was #2674) (#2698),1783,3228,1621,1946864,3152,,,3107
c0d4de3c,2025-04-18,Update mom6 to its main repository 20250411 commit (#2697),1779,3223,1620,1940516,3155,,,3108
7cc588ae,2025-04-16,Add PIO configuration variables for CMEPS + Update CCPP framework and physics CMakeLists.txt; forward ccpp-framework to HEAD of main #2659 (#2695),1784,3252,1619,1938512,3155,,,3108
9b9a6304,2025-04-11,Memcheck fixes (#2655),1773,3247,1622,1939864,3154,,,3109
4e75e7b4,2025-04-10,Update upp submodule to the latest UPP (#2682),1781,3254,1617,1949612,3153,,,3111
69d03840,2025-04-07,Use ESMF Redist instead of Remap for FV3 history bundles with 'cubed_sphere_grid' output grid (#2595),1786,3231,1614,1958660,3154,,,3111
0d1af3e3,2025-04-02,"Convert GFS DDTs from blocked data structures to contiguous arrays: Part Deux  + CCPP updates in fv3atm/ccpp-physics: split physics in two groups, reset GFS_interstitial DDT in CCPP_driver.F90 #2651 + Hera move spack-stack to /contrib #2579 (#2610)",1783,3262,1614,1958428,3153,,,3109
6ece76a2,2025-03-28,Update WW3  by merging develop  as of 2025-03-20 (#2669),1782,3214,1617,1950884,3155,,,3111
