Hash,Date,Message,orion,hera,gaeac6,hercules,derecho,ursa,wcoss2,acorn
5e3a9259,2025-09-10,Introduce tuning parameter for convective cloud liquid for GFSv17/GEFSv13/SFSv1 (#2872),1944,2076,1776,1983,1902,2592,1919,1913
e7ee38e2,2025-09-08,Scale-aware 3DTKE EDMF and TTE-EDMF GFS PBL related updates (#2806),1943,2047,1781,1980180,1902,2590,1918,1913
688de8eb,2025-09-04,Fix default cdmbgwd settings (#2788),1958976,2064,1781,1980484,1902,2596,1903,1914
7e711129,2025-09-02,Use container with spack stack 1.9.2 (#2870),1954,2063,1782,1982136,1902,2595,1918,1913
d4bac232,2025-08-29,MPAS dycore + Atmosphere Generalization & Update RAP tests to FHMAX=12 (#2780),1954,2063,1782,1982136,1902,2595,1918,1913
118cff46,2025-08-25,Add FV3 grid mask for regional domains to speed up nearest n. interpolation; Update CMEPS and CDEPS (#2862) (#2818),1948,2057,1781,1975,1897,2595160,1919,1913
071b9f95,2025-08-22,Fix Restart IAU and Ultra-Low Reproducibility Issues by Adding Control Parameter to Restart File (#2851),1948,2078,1773,1982980,1900,2597,1919,1911
dc9cfba6,2025-08-19,Update CICE through 2025-07 and switch to ice history variables with expected ranges. Sync of WW3 develop to dev/ufs-weather-model (#2852),1957,2074,1775,1982420,1899,2585,1921,1911
a180bbe4,2025-08-15,FV3: Fix Prate_avg and UPP call freq + Fixing repo sync check with proper if...else block and re-instatiatin… #2859 (#2836),1954508,2076,1779,1984880,1901996,2590,1910,1912
417a2cf1,2025-08-13,Fix conus13km tests restart and decomposition reproducibility + Update the detection of Hera/Ursa #2858 (#2753),1946,2085,1778,1983336,1897192,2578,1921,1912
61e54d9b,2025-08-11,Add two-way ocean-wave coupling feature to the HAFS applications (#2584),1957,2079,1774,1991552,1901024,2595,1920,1913
ce74044c,2025-08-06,"Create a user-friendly ""process model"" testing capability + update MOM6 to its main repo. 20250801 commit #2849 (#2719)",1961,2084,1775,1983836,1900032,2590,1916,1912
d820b67f,2025-08-01,Update GOCART to v2.4.3 (#2819),1955,2082,1779,1984396,1900776,2594,1918,1914
5e13aaf2,2025-07-29,Update DATM meshes and switch to bilinear mapping; Reinstate med restarts for 4 tests after update to ESMF 8.8 (was #2796) (#2733),1960,2066,1781956,1984992,1903,2592,1917,1914
e39a250c,2025-07-24,Update FV3 hash to include UPP ss192/Ursa updates (#2814),1949,2078,1771856,1985068,1903,2588,1920,1914
8b52797d,2025-07-21,"Combination of 2684,2707,2771 (MERRA2 3-hr, photochem diag, prog closure SFS) (#2813)",1948,2075,1778,1976792,1902,2595,1919,1915
93d51aef,2025-07-17,Exporting Canopy Variables from AQM to Facilitate Sub-Canopy Effects in FV3 and CCPP (#2630),1947,2079,1777,1993520,1891,2592,1918,1915
c5b3a3c8,2025-07-14,GFDLMP-v3 and TEMPO MP microphysics (#2503),1956,2077,1776676,1983160,1901,2594,1917,1913
f9c10462,2025-07-11,Combination of several CCPP-physics PRs (#2790),1941,2069,1778944,1988044,1902,2594,1918,1915
0e960577,2025-07-09,"Combination #2777 (maintask writes CMEPS restart log), #2779 (FV3 CI/CD), and fix RT if statement blocks (#2795)",1951,2079,1773,1975,1900,2587,1919,1914
065def80,2025-07-07,Port UFS-WM to Ursa (#2471),1961,2040,1771,1988288,1905,2608,1915,1915
995c51d1,2025-07-03,Upgrade UFS-WM to spack-stack/1.9.2 (#2650),1961,2040,1771,1985,1905,,1915,1915
1f0ab432,2025-07-01,Reduce WW3 memory use (#2624),1946,1974,1785,1981952,1908,,1903,1913
8f8fddc8,2025-06-30,Bring in scale-aware 3DTKE related changes for GFS TKE EDMF PBL scheme #2734; Add option in GFS PBL to use liquid/ice potential temperature in local mixing #2763; Update MOM6 to its main repo. 20250527 commit #2757; Mom6 025 warmstart option #2761 (#2734),1947,1970,1775,1978,1909,,1897,1914
24d8dfd4,2025-06-26,Slight modification in orographic gravity wave drag (OGWD) scheme (#2752),1941,1962,1778,1981152,1908,,1903,1907
5750b9e3,2025-06-20,gcycle update (#2747),1948,1966,1779,1977544,1911,,1914,1907
a9999828,2025-06-12,Add a new parameter in dycore to control cutoff level for implicit RF  (#2730),1949388,1964,1776,1984948,1911,,1905,1912
9193010a,2025-06-06,"In Noah-MP, set zero for canopy liquid and canopy ice over glacier  (#2723)",1953,1967,1774,1984724,1901,,1914,1908
43f2c3bd,2025-06-04,Urgent Documentation Update for HSD Capability Announcement  (#2765),1943,1970,1776,1981928,1901,,1906,1907
f22b2e11,2025-06-02,Bug fix for surface roughness calculation over lakes and sea ice points when wave model is turned on (#2739),1943,1970,1776,1981928,1901,,1906,1907
aebf9781,2025-05-27,Fix bug to improve wave initialization by saving location/weights for point output (#2737),1950,1951,1777,1980592,1909,,1905,1906
4cbe50f4,2025-05-23,"Add idealized, regional tropical cyclone test to tests-dev (#2693)",1947,1954,1781,1978136,1911,,1900,1908
269e181a,2025-05-23,Add GFSv17 IAU restart tests without waves + Add tags to stoch physics int variables + Fix filepath in user's guide (#2691),1947,1954,1781,1978136,1911,,1900,1908
68fd7faa,2025-05-15,"Enable Hera, Hercules Gnu tests: cpld_debug_p8_gnu and cpld_control_p8_gnu + revert MOM6 ISO code #2729 (#2694)",1946,1968,1776,1979728,1902,,1914,1906
1c5a9f12,2025-05-09,"Add ""ultra low"" coupled configurations to RTs (Reopen #2564); update inputdata; clean up misc items in multiple test configurations (#2663)",1946,1962,1776,1979288,1902,,1914,1906
aba31a4e,2025-05-06,Resolve miscellaneous WM issues and update documentation (#2633),1953,1950,1774,1979564,1912,,1902,1912
b81282e5,2025-05-05,Switch to vector remapping and bilinear interpolation for global coupled configurations (#2690),1953,1950,1774,1983060,1912,,1902,1912
5a297a6e,2025-05-02,improve coupled model startup cost for waves; Add switch to disable InfoBroadcast in fv3 cap run phase2 (was #2721) (#2715),1946,1959,1777,1985940,1909,,1901,1913
ff162f36,2025-05-01,NSSL MP scheme updates + Stochastic Physics CI/CD & Unit Test (#2661),1947,1951,1773,1983232,1910,,1907,1907
9e4778cd,2025-04-25,Loosen restriction on optional arguments in CCPP Framework (#2573),1945,1957,1776,1985584,1903,,1906,1905
4a566203,2025-04-23,CMake Atmosphere Dycore Generalization + Fix for JEDI cubed sphere grid #2708 (#2604),1946,1952,1784,1989352,1908,,1912,1909
4f0111b2,2025-04-21,Add CMEPS log file at restart write; IAU Tags for Global Workflow (was #2674) (#2698),1943,1954,1779,1977052,1903,,1910,1910
c0d4de3c,2025-04-18,Update mom6 to its main repository 20250411 commit (#2697),1952,1941,1775,1984700,1908,,1911,1910
7cc588ae,2025-04-16,Add PIO configuration variables for CMEPS + Update CCPP framework and physics CMakeLists.txt; forward ccpp-framework to HEAD of main #2659 (#2695),1944,1952,1773,1976964,1910,,1907,1911
9b9a6304,2025-04-11,Memcheck fixes (#2655),1948,1959,1772,1977100,1909,,1909,1910
4e75e7b4,2025-04-10,Update upp submodule to the latest UPP (#2682),1943,1942,1773,1979284,1910,,1913,1907
69d03840,2025-04-07,Use ESMF Redist instead of Remap for FV3 history bundles with 'cubed_sphere_grid' output grid (#2595),1946,1939,1775,1985684,1906,,1906,1907
0d1af3e3,2025-04-02,"Convert GFS DDTs from blocked data structures to contiguous arrays: Part Deux  + CCPP updates in fv3atm/ccpp-physics: split physics in two groups, reset GFS_interstitial DDT in CCPP_driver.F90 #2651 + Hera move spack-stack to /contrib #2579 (#2610)",1949,1974,1775,1985596,1909,,1908,1905
6ece76a2,2025-03-28,Update WW3  by merging develop  as of 2025-03-20 (#2669),1956,1953,1780,1985748,1914,,1912,1911
c5f801e4,2025-03-27,Sync CDEPS and CMEPS to ESCOMP (#2664),1956,1962,1775,1978836,1907,,1912,1912
