Hash,Date,Message,orion,hera,gaeac6,hercules,derecho,ursa,wcoss2,acorn
42c7a0ad,2025-09-22,Send surface ocean currents to ATM for SFS test (#2689),1219,967,1046,950,,867,1196,1195
db4e2d0f,2025-09-18,Replace icplocn2atm (integer) with use_oceanuv (logical); Update cloud build env to remove gnu from stack (was #2842) (#2867),1230,965,1047,949,,865,1188,1197
990ca94c,2025-09-16,Update tests such that LSM and LANDICE are set appropriately (#2772),1218,968,1044,950,,867,1194,1191
d3caf3e5,2025-09-15,update mom6 to its main repo. 20250818 commit (#2866),1211,974,1045,951,,868,1186,1197
5e3a9259,2025-09-10,Introduce tuning parameter for convective cloud liquid for GFSv17/GEFSv13/SFSv1 (#2872),1222,967,1044,949,,867,1188,1196
e7ee38e2,2025-09-08,Scale-aware 3DTKE EDMF and TTE-EDMF GFS PBL related updates (#2806),1224,969,1045,953868,,867,1195,1193
688de8eb,2025-09-04,Fix default cdmbgwd settings (#2788),1205860,965,1047,951660,1184,867,1189,1195
7e711129,2025-09-02,Use container with spack stack 1.9.2 (#2870),1215,969,1047,949040,1184,866,1195,1191
d4bac232,2025-08-29,MPAS dycore + Atmosphere Generalization & Update RAP tests to FHMAX=12 (#2780),1215,969,1047,949040,1184,866,1195,1191
118cff46,2025-08-25,Add FV3 grid mask for regional domains to speed up nearest n. interpolation; Update CMEPS and CDEPS (#2862) (#2818),1214,956,1042,952,1184,867080,1193,1187
071b9f95,2025-08-22,Fix Restart IAU and Ultra-Low Reproducibility Issues by Adding Control Parameter to Restart File (#2851),1237,964,1047,953024,1183,868,1190,1189
dc9cfba6,2025-08-19,Update CICE through 2025-07 and switch to ice history variables with expected ranges. Sync of WW3 develop to dev/ufs-weather-model (#2852),1218,964,1046,953220,1182,866,1195,1189
a180bbe4,2025-08-15,FV3: Fix Prate_avg and UPP call freq + Fixing repo sync check with proper if...else block and re-instatiatin… #2859 (#2836),1215644,966,1044,953792,1180008,867,1192,1194
417a2cf1,2025-08-13,Fix conus13km tests restart and decomposition reproducibility + Update the detection of Hera/Ursa #2858 (#2753),1218,965,1046,949536,1182944,868,1191,1191
61e54d9b,2025-08-11,Add two-way ocean-wave coupling feature to the HAFS applications (#2584),1221,964,1042,952200,1182772,867,1195,1195
ce74044c,2025-08-06,"Create a user-friendly ""process model"" testing capability + update MOM6 to its main repo. 20250801 commit #2849 (#2719)",1221,966,1044,953380,1185844,866,1195,1195
d820b67f,2025-08-01,Update GOCART to v2.4.3 (#2819),1225,962,1045,951984,1180760,867,1196,1196
5e13aaf2,2025-07-29,Update DATM meshes and switch to bilinear mapping; Reinstate med restarts for 4 tests after update to ESMF 8.8 (was #2796) (#2733),1215,963,1041928,949628,,865,1192,1195
e39a250c,2025-07-24,Update FV3 hash to include UPP ss192/Ursa updates (#2814),1217,963,1043080,952956,1182,865,1196,1191
8b52797d,2025-07-21,"Combination of 2684,2707,2771 (MERRA2 3-hr, photochem diag, prog closure SFS) (#2813)",1213,961,1047,951132,1178,866,1196,1195
93d51aef,2025-07-17,Exporting Canopy Variables from AQM to Facilitate Sub-Canopy Effects in FV3 and CCPP (#2630),1205,958,1040,951524,1177,865,1198,1194
c5b3a3c8,2025-07-14,GFDLMP-v3 and TEMPO MP microphysics (#2503),1220,966,1046524,951648,1187,866,1198,1193
f9c10462,2025-07-11,Combination of several CCPP-physics PRs (#2790),1226,965,1041136,949596,1180,866,1196,1198
0e960577,2025-07-09,"Combination #2777 (maintask writes CMEPS restart log), #2779 (FV3 CI/CD), and fix RT if statement blocks (#2795)",1217,967,1043,955,1189,866,1195,1196
065def80,2025-07-07,Port UFS-WM to Ursa (#2471),1227,968,1042,950768,1181,866,1190,1198
995c51d1,2025-07-03,Upgrade UFS-WM to spack-stack/1.9.2 (#2650),1227,968,1042,951,1181,,1190,1198
1f0ab432,2025-07-01,Reduce WW3 memory use (#2624),1213,966,1043,956768,1192,,1190,1200
8f8fddc8,2025-06-30,Bring in scale-aware 3DTKE related changes for GFS TKE EDMF PBL scheme #2734; Add option in GFS PBL to use liquid/ice potential temperature in local mixing #2763; Update MOM6 to its main repo. 20250527 commit #2757; Mom6 025 warmstart option #2761 (#2734),1215,963,1046,957,1195,,1192,1200
24d8dfd4,2025-06-26,Slight modification in orographic gravity wave drag (OGWD) scheme (#2752),1216,967,1044,955676,1188,,1188,1196
5750b9e3,2025-06-20,gcycle update (#2747),1208,963,1043,954772,1189,,1187,1199
a9999828,2025-06-12,Add a new parameter in dycore to control cutoff level for implicit RF  (#2730),1213448,965,1044,952544,1187,,1196,1200
9193010a,2025-06-06,"In Noah-MP, set zero for canopy liquid and canopy ice over glacier  (#2723)",1208,962,1048,953300,,,1195,1198
43f2c3bd,2025-06-04,Urgent Documentation Update for HSD Capability Announcement  (#2765),1212,965,1045,955160,1189,,1197,1198
f22b2e11,2025-06-02,Bug fix for surface roughness calculation over lakes and sea ice points when wave model is turned on (#2739),1212,965,1045,955160,1189,,1197,1198
aebf9781,2025-05-27,Fix bug to improve wave initialization by saving location/weights for point output (#2737),1215,946,1043,951916,1192,,1189,1200
4cbe50f4,2025-05-23,"Add idealized, regional tropical cyclone test to tests-dev (#2693)",1216,947,1044,954096,1191,,1194,1198
269e181a,2025-05-23,Add GFSv17 IAU restart tests without waves + Add tags to stoch physics int variables + Fix filepath in user's guide (#2691),1216,947,1044,954096,1191,,1194,1198
68fd7faa,2025-05-15,"Enable Hera, Hercules Gnu tests: cpld_debug_p8_gnu and cpld_control_p8_gnu + revert MOM6 ISO code #2729 (#2694)",1218,967,1046,952888,1188,,1192,1196
1c5a9f12,2025-05-09,"Add ""ultra low"" coupled configurations to RTs (Reopen #2564); update inputdata; clean up misc items in multiple test configurations (#2663)",1218,859,1046,1090032,1188,,1192,1196
aba31a4e,2025-05-06,Resolve miscellaneous WM issues and update documentation (#2633),1215,846,1044,1087584,1191,,1192,1198
b81282e5,2025-05-05,Switch to vector remapping and bilinear interpolation for global coupled configurations (#2690),1215,846,1044,1090704,1191,,1192,1198
5a297a6e,2025-05-02,improve coupled model startup cost for waves; Add switch to disable InfoBroadcast in fv3 cap run phase2 (was #2721) (#2715),1213,839,1044,1094028,1193,,1190,1197
ff162f36,2025-05-01,NSSL MP scheme updates + Stochastic Physics CI/CD & Unit Test (#2661),1218,840,1043,1084992,1193,,1192,1196
9e4778cd,2025-04-25,Loosen restriction on optional arguments in CCPP Framework (#2573),1219,846,1043,1086928,1190,,1194,1198
4a566203,2025-04-23,CMake Atmosphere Dycore Generalization + Fix for JEDI cubed sphere grid #2708 (#2604),1214,838,1045,1088996,1189,,1191,1199
4f0111b2,2025-04-21,Add CMEPS log file at restart write; IAU Tags for Global Workflow (was #2674) (#2698),1212,841,1048,1087176,1189,,1193,1199
c0d4de3c,2025-04-18,Update mom6 to its main repository 20250411 commit (#2697),1214,841,1043,1093916,1190,,1193,1200
7cc588ae,2025-04-16,Add PIO configuration variables for CMEPS + Update CCPP framework and physics CMakeLists.txt; forward ccpp-framework to HEAD of main #2659 (#2695),1213,858,1043,1084740,1191,,1193,1199
9b9a6304,2025-04-11,Memcheck fixes (#2655),1218,861,1047,1088680,1190,,1193,1200
4e75e7b4,2025-04-10,Update upp submodule to the latest UPP (#2682),1218,832,1043,1087772,1193,,1197,1198
