Hash,Date,Message,orion,hera,gaeac6,hercules,derecho,ursa,wcoss2,acorn
5e3a9259,2025-09-10,Introduce tuning parameter for convective cloud liquid for GFSv17/GEFSv13/SFSv1 (#2872),1107,1226,887,1205,,1684,882,882
e7ee38e2,2025-09-08,Scale-aware 3DTKE EDMF and TTE-EDMF GFS PBL related updates (#2806),1104,1237,892,1202340,,1700,882,882
688de8eb,2025-09-04,Fix default cdmbgwd settings (#2788),1107016,1241,887,1208240,,1696,882,881
7e711129,2025-09-02,Use container with spack stack 1.9.2 (#2870),1109,1241,886,1204968,890,1688,883,883
d4bac232,2025-08-29,MPAS dycore + Atmosphere Generalization & Update RAP tests to FHMAX=12 (#2780),1109,1241,886,1204968,890,1688,883,883
118cff46,2025-08-25,Add FV3 grid mask for regional domains to speed up nearest n. interpolation; Update CMEPS and CDEPS (#2862) (#2818),1103,1240,891,1200,894,1691396,885,885
071b9f95,2025-08-22,Fix Restart IAU and Ultra-Low Reproducibility Issues by Adding Control Parameter to Restart File (#2851),1103,1236,889,1210980,891,1695,884,885
dc9cfba6,2025-08-19,Update CICE through 2025-07 and switch to ice history variables with expected ranges. Sync of WW3 develop to dev/ufs-weather-model (#2852),1106,1240,883,1207888,890,1696,884,885
a180bbe4,2025-08-15,FV3: Fix Prate_avg and UPP call freq + Fixing repo sync check with proper if...else block and re-instatiatin… #2859 (#2836),1108152,1241,886,1208580,892720,1688,884,885
417a2cf1,2025-08-13,Fix conus13km tests restart and decomposition reproducibility + Update the detection of Hera/Ursa #2858 (#2753),1103,1228,886,1195860,893508,1704,885,885
61e54d9b,2025-08-11,Add two-way ocean-wave coupling feature to the HAFS applications (#2584),1107,1244,886,1200344,892960,1687,885,884
ce74044c,2025-08-06,"Create a user-friendly ""process model"" testing capability + update MOM6 to its main repo. 20250801 commit #2849 (#2719)",1105,1238,890,1196908,894856,1704,885,883
d820b67f,2025-08-01,Update GOCART to v2.4.3 (#2819),1106,1240,884,1209448,890800,1688,884,886
5e13aaf2,2025-07-29,Update DATM meshes and switch to bilinear mapping; Reinstate med restarts for 4 tests after update to ESMF 8.8 (was #2796) (#2733),1105,1236,880836,1207528,,1701,885,885
e39a250c,2025-07-24,Update FV3 hash to include UPP ss192/Ursa updates (#2814),1107,1237,887324,1212064,891,1694,885,886
8b52797d,2025-07-21,"Combination of 2684,2707,2771 (MERRA2 3-hr, photochem diag, prog closure SFS) (#2813)",1105,1236,885,1210268,891,1709,884,887
93d51aef,2025-07-17,Exporting Canopy Variables from AQM to Facilitate Sub-Canopy Effects in FV3 and CCPP (#2630),1105,1237,890,1205340,894,1694,886,884
c5b3a3c8,2025-07-14,GFDLMP-v3 and TEMPO MP microphysics (#2503),1110,1244,885324,1206784,883,1695,885,886
f9c10462,2025-07-11,Combination of several CCPP-physics PRs (#2790),1107,1240,884112,1207400,884,1695,883,885
0e960577,2025-07-09,"Combination #2777 (maintask writes CMEPS restart log), #2779 (FV3 CI/CD), and fix RT if statement blocks (#2795)",1111,1244,886,1202,887,1689,883,885
065def80,2025-07-07,Port UFS-WM to Ursa (#2471),1110,1246,885,1206956,,1707,877,886
995c51d1,2025-07-03,Upgrade UFS-WM to spack-stack/1.9.2 (#2650),1110,1246,885,1212,890,,877,886
1f0ab432,2025-07-01,Reduce WW3 memory use (#2624),1102,1135,887,1206288,897,,880,886
8f8fddc8,2025-06-30,Bring in scale-aware 3DTKE related changes for GFS TKE EDMF PBL scheme #2734; Add option in GFS PBL to use liquid/ice potential temperature in local mixing #2763; Update MOM6 to its main repo. 20250527 commit #2757; Mom6 025 warmstart option #2761 (#2734),1102,1146,886,1197,896,,883,885
24d8dfd4,2025-06-26,Slight modification in orographic gravity wave drag (OGWD) scheme (#2752),1101,1144,886,1195364,896,,884,887
5750b9e3,2025-06-20,gcycle update (#2747),1100,1146,884,1199568,896,,878,884
a9999828,2025-06-12,Add a new parameter in dycore to control cutoff level for implicit RF  (#2730),1099888,1129,884,1204800,891,,884,881
9193010a,2025-06-06,"In Noah-MP, set zero for canopy liquid and canopy ice over glacier  (#2723)",1103,1145,885,1203,,,882,881
43f2c3bd,2025-06-04,Urgent Documentation Update for HSD Capability Announcement  (#2765),1103,,,1200172,,,,
f22b2e11,2025-06-02,Bug fix for surface roughness calculation over lakes and sea ice points when wave model is turned on (#2739),1103,1147,885,1200172,895,,883,885
aebf9781,2025-05-27,Fix bug to improve wave initialization by saving location/weights for point output (#2737),1104,1131,885,1200392,890,,877,885
4cbe50f4,2025-05-23,"Add idealized, regional tropical cyclone test to tests-dev (#2693)",1108,1132,884,1190600,891,,879,880
269e181a,2025-05-23,Add GFSv17 IAU restart tests without waves + Add tags to stoch physics int variables + Fix filepath in user's guide (#2691),1108,1132,884,1190600,891,,879,880
68fd7faa,2025-05-15,"Enable Hera, Hercules Gnu tests: cpld_debug_p8_gnu and cpld_control_p8_gnu + revert MOM6 ISO code #2729 (#2694)",,1148,,1198144,,,,
1c5a9f12,2025-05-09,"Add ""ultra low"" coupled configurations to RTs (Reopen #2564); update inputdata; clean up misc items in multiple test configurations (#2663)",1101,1144,884,1201972,896,,884,886
aba31a4e,2025-05-06,Resolve miscellaneous WM issues and update documentation (#2633),1083,1119,885,1198976,898,,883,884
b81282e5,2025-05-05,Switch to vector remapping and bilinear interpolation for global coupled configurations (#2690),1083,1119,885,1203976,898,,883,884
5a297a6e,2025-05-02,improve coupled model startup cost for waves; Add switch to disable InfoBroadcast in fv3 cap run phase2 (was #2721) (#2715),1098,1134,882,1197324,896,,883,880
ff162f36,2025-05-01,NSSL MP scheme updates + Stochastic Physics CI/CD & Unit Test (#2661),1100,1134,884,1192284,890,,883,884
9e4778cd,2025-04-25,Loosen restriction on optional arguments in CCPP Framework (#2573),1099,1134,888,1204572,893,,883,884
4a566203,2025-04-23,CMake Atmosphere Dycore Generalization + Fix for JEDI cubed sphere grid #2708 (#2604),1099,1129,885,1192268,891,,883,884
4f0111b2,2025-04-21,Add CMEPS log file at restart write; IAU Tags for Global Workflow (was #2674) (#2698),1104,1136,884,1201332,891,,882,884
c0d4de3c,2025-04-18,Update mom6 to its main repository 20250411 commit (#2697),1093,1128,887,1199024,882,,882,880
7cc588ae,2025-04-16,Add PIO configuration variables for CMEPS + Update CCPP framework and physics CMakeLists.txt; forward ccpp-framework to HEAD of main #2659 (#2695),1098,1149,884,1202968,892,,882,881
9b9a6304,2025-04-11,Memcheck fixes (#2655),1105,1149,888,1197264,892,,882,884
4e75e7b4,2025-04-10,Update upp submodule to the latest UPP (#2682),1121,1168,902,1218508,912,,901,898
69d03840,2025-04-07,Use ESMF Redist instead of Remap for FV3 history bundles with 'cubed_sphere_grid' output grid (#2595),1122,1157,,1218088,913,,901,899
0d1af3e3,2025-04-02,"Convert GFS DDTs from blocked data structures to contiguous arrays: Part Deux  + CCPP updates in fv3atm/ccpp-physics: split physics in two groups, reset GFS_interstitial DDT in CCPP_driver.F90 #2651 + Hera move spack-stack to /contrib #2579 (#2610)",1122,1168,903,1202072,913,,901,900
6ece76a2,2025-03-28,Update WW3  by merging develop  as of 2025-03-20 (#2669),1123,1164,909,1221592,915,,908,904
c5f801e4,2025-03-27,Sync CDEPS and CMEPS to ESCOMP (#2664),1121,1155,910,1221116,918,,908,904
