Hash,Date,Message,orion,hera,gaeac6,hercules,derecho,ursa,wcoss2,acorn
5e3a9259,2025-09-10,Introduce tuning parameter for convective cloud liquid for GFSv17/GEFSv13/SFSv1 (#2872),1028,492,671,420,,339,1160,1102
e7ee38e2,2025-09-08,Scale-aware 3DTKE EDMF and TTE-EDMF GFS PBL related updates (#2806),1073,504,676,405,,339,1128,1111
688de8eb,2025-09-04,Fix default cdmbgwd settings (#2788),1115,498,661,401,,332,1118,1087
7e711129,2025-09-02,Use container with spack stack 1.9.2 (#2870),1008,502,662,410,954,336,1113,1096
d4bac232,2025-08-29,MPAS dycore + Atmosphere Generalization & Update RAP tests to FHMAX=12 (#2780),1008,502,662,410,954,336,1113,1096
118cff46,2025-08-25,Add FV3 grid mask for regional domains to speed up nearest n. interpolation; Update CMEPS and CDEPS (#2862) (#2818),1055,502,684,415,941,1494,1109,1096
071b9f95,2025-08-22,Fix Restart IAU and Ultra-Low Reproducibility Issues by Adding Control Parameter to Restart File (#2851),1154,508,671,560,948,1397,1108,1118
dc9cfba6,2025-08-19,Update CICE through 2025-07 and switch to ice history variables with expected ranges. Sync of WW3 develop to dev/ufs-weather-model (#2852),1211,498,663,448,936,344,1118,1106
a180bbe4,2025-08-15,FV3: Fix Prate_avg and UPP call freq + Fixing repo sync check with proper if...else block and re-instatiatin… #2859 (#2836),1012,497,666,465,969,327,1123,1100
417a2cf1,2025-08-13,Fix conus13km tests restart and decomposition reproducibility + Update the detection of Hera/Ursa #2858 (#2753),1024,509,669,510,957,1520,1126,1086
61e54d9b,2025-08-11,Add two-way ocean-wave coupling feature to the HAFS applications (#2584),1135,522,674,391,955,362,1113,1099
ce74044c,2025-08-06,"Create a user-friendly ""process model"" testing capability + update MOM6 to its main repo. 20250801 commit #2849 (#2719)",1039,502,680,456,952,350,1123,1088
d820b67f,2025-08-01,Update GOCART to v2.4.3 (#2819),1039,508,680,397,940,341,1124,1096
5e13aaf2,2025-07-29,Update DATM meshes and switch to bilinear mapping; Reinstate med restarts for 4 tests after update to ESMF 8.8 (was #2796) (#2733),1005,499,670,397,,333,1099,1091
e39a250c,2025-07-24,Update FV3 hash to include UPP ss192/Ursa updates (#2814),1196,508,673,452,978,343,1115,1096
8b52797d,2025-07-21,"Combination of 2684,2707,2771 (MERRA2 3-hr, photochem diag, prog closure SFS) (#2813)",1073,493,673,431,982,345,1118,1105
93d51aef,2025-07-17,Exporting Canopy Variables from AQM to Facilitate Sub-Canopy Effects in FV3 and CCPP (#2630),1105,508,679,472,979,338,1158,1106
c5b3a3c8,2025-07-14,GFDLMP-v3 and TEMPO MP microphysics (#2503),1080,510,688,495,978,333,1130,1106
f9c10462,2025-07-11,Combination of several CCPP-physics PRs (#2790),1084,586,672,404,976,339,1109,1100
0e960577,2025-07-09,"Combination #2777 (maintask writes CMEPS restart log), #2779 (FV3 CI/CD), and fix RT if statement blocks (#2795)",1061,579,661,526,989,420,1105,1099
065def80,2025-07-07,Port UFS-WM to Ursa (#2471),1027,496,673,386,,335,1096,1091
995c51d1,2025-07-03,Upgrade UFS-WM to spack-stack/1.9.2 (#2650),1027,496,673,381,996,,1096,1091
1f0ab432,2025-07-01,Reduce WW3 memory use (#2624),1016,517,675,423,976,,1108,1098
8f8fddc8,2025-06-30,Bring in scale-aware 3DTKE related changes for GFS TKE EDMF PBL scheme #2734; Add option in GFS PBL to use liquid/ice potential temperature in local mixing #2763; Update MOM6 to its main repo. 20250527 commit #2757; Mom6 025 warmstart option #2761 (#2734),1264,491,677,515,972,,1102,1109
24d8dfd4,2025-06-26,Slight modification in orographic gravity wave drag (OGWD) scheme (#2752),1142,488,668,391,978,,1128,1093
5750b9e3,2025-06-20,gcycle update (#2747),1029,506,667,398,978,,1099,1108
a9999828,2025-06-12,Add a new parameter in dycore to control cutoff level for implicit RF  (#2730),1368,489,683,470,974,,1105,1098
9193010a,2025-06-06,"In Noah-MP, set zero for canopy liquid and canopy ice over glacier  (#2723)",1084,496,672,612,,,1112,1096
43f2c3bd,2025-06-04,Urgent Documentation Update for HSD Capability Announcement  (#2765),1037,,,424,,,,
f22b2e11,2025-06-02,Bug fix for surface roughness calculation over lakes and sea ice points when wave model is turned on (#2739),1037,507,664,424,989,,1120,1090
aebf9781,2025-05-27,Fix bug to improve wave initialization by saving location/weights for point output (#2737),1082,514,664,437,959,,1098,1104
4cbe50f4,2025-05-23,"Add idealized, regional tropical cyclone test to tests-dev (#2693)",1077,497,647,492,960,,1109,1093
269e181a,2025-05-23,Add GFSv17 IAU restart tests without waves + Add tags to stoch physics int variables + Fix filepath in user's guide (#2691),1077,497,647,492,960,,1109,1093
68fd7faa,2025-05-15,"Enable Hera, Hercules Gnu tests: cpld_debug_p8_gnu and cpld_control_p8_gnu + revert MOM6 ISO code #2729 (#2694)",,510,,415,,,,
1c5a9f12,2025-05-09,"Add ""ultra low"" coupled configurations to RTs (Reopen #2564); update inputdata; clean up misc items in multiple test configurations (#2663)",1022,697,681,392,968,,1145,1098
aba31a4e,2025-05-06,Resolve miscellaneous WM issues and update documentation (#2633),1103,634,683,497,952,,1121,1091
b81282e5,2025-05-05,Switch to vector remapping and bilinear interpolation for global coupled configurations (#2690),1103,634,683,411,952,,1121,1091
5a297a6e,2025-05-02,improve coupled model startup cost for waves; Add switch to disable InfoBroadcast in fv3 cap run phase2 (was #2721) (#2715),1200,702,667,422,940,,1091,1094
ff162f36,2025-05-01,NSSL MP scheme updates + Stochastic Physics CI/CD & Unit Test (#2661),1041,721,675,423,978,,1175,1079
9e4778cd,2025-04-25,Loosen restriction on optional arguments in CCPP Framework (#2573),1058,629,686,394,968,,1099,1083
4a566203,2025-04-23,CMake Atmosphere Dycore Generalization + Fix for JEDI cubed sphere grid #2708 (#2604),1087,655,672,388,975,,1126,1085
4f0111b2,2025-04-21,Add CMEPS log file at restart write; IAU Tags for Global Workflow (was #2674) (#2698),1074,634,677,391,975,,1103,1085
c0d4de3c,2025-04-18,Update mom6 to its main repository 20250411 commit (#2697),1028,683,686,443,988,,1099,1086
7cc588ae,2025-04-16,Add PIO configuration variables for CMEPS + Update CCPP framework and physics CMakeLists.txt; forward ccpp-framework to HEAD of main #2659 (#2695),1028,721,673,511,1001,,1134,1087
9b9a6304,2025-04-11,Memcheck fixes (#2655),1089,695,683,398,972,,1112,1098
4e75e7b4,2025-04-10,Update upp submodule to the latest UPP (#2682),1069,742,662,398,935,,1105,1082
69d03840,2025-04-07,Use ESMF Redist instead of Remap for FV3 history bundles with 'cubed_sphere_grid' output grid (#2595),1037,687,,472,971,,1126,1084
0d1af3e3,2025-04-02,"Convert GFS DDTs from blocked data structures to contiguous arrays: Part Deux  + CCPP updates in fv3atm/ccpp-physics: split physics in two groups, reset GFS_interstitial DDT in CCPP_driver.F90 #2651 + Hera move spack-stack to /contrib #2579 (#2610)",1048,672,659,468,970,,1110,1095
6ece76a2,2025-03-28,Update WW3  by merging develop  as of 2025-03-20 (#2669),1035,609,674,486,974,,1106,1082
c5f801e4,2025-03-27,Sync CDEPS and CMEPS to ESCOMP (#2664),1027,736,666,457,974,,1117,1083
